pedido,fecha_de_realizado,estado,titulo_url,organismo
Cantidad de muertes por violencia doméstica 2000 - 2013,2013-08-28 18:16:02.042084,parcialmente_exitoso,cantidad_de_muertes_por_violenci,Dirección General de Secretaría del Ministerio del Interior
Informe ambiental  anual Ley 17.283,2013-10-06 23:46:35.39744,esperando_respuesta,informe_ambiental_anual_ley_1728,Ministerio de Vivienda Ordenamiento Territorial y Medio Ambiente
Eliminacion del Detalle de la Factura,2014-01-26 21:32:57.614555,rechazado,eliminacion_del_detalle_de_la_fa,ANTEL
Nombres de las personas que resultaron seleccionadas en el Llamado N° 360/2013 de COORDINADOR DEPARTAMENTAL DEL MTOP,2014-02-11 13:46:55.359819,esperando_respuesta,nombres_de_las_personas_que_resu,Ministerio de Transporte y Obras Públicas
solicitud de informes al ZOO Villa Dolores,2013-01-02 22:40:17.107726,rechazado,solicitud_de_informes_al_zoo_vil,Intendencia de Montevideo
Solicitud de acceso al expediente de Efice en la división de SADI,2013-01-05 14:53:58.509013,rechazado,solicitud_de_acceso_al_expedient,Ministerio de Vivienda Ordenamiento Territorial y Medio Ambiente
Copia del recibo de sueldo del Presidente,2013-02-13 15:55:08.934426,rechazado,copia_del_recibo_de_sueldo_del_p,Dirección General de Presidencia de la República
Presupuesto y ejecución según rubros del programa Uruguay a toda Costa del año 2012,2013-01-17 01:54:47.926625,rechazado,presupuesto_y_ejecucin_segn_rubr,Ministerio de Turismo y Deporte
patente de rodado AOF,2013-01-17 23:41:42.417327,rechazado,patente_de_rodado_aof,Congreso de Intendentes
"Resultados detallados de análisis químicos del agua para consumo humano, desde diciembre 2012 a marzo 2013 inclusive.",2013-04-04 02:54:32.986723,terminado_por_usuario,resultados_detallados_de_anlisis,Administración de las Obras Sanitarias del Estado
"Cuánto dinero es destinado a la Salud, y cuánto significa en porcentaje del gasto público",2013-05-06 15:19:31.498566,rechazado,cunto_dinero_es_destinado_a_la_s,Dirección General de Secretaría del Ministerio de Salud Pública
Sociedades anónimas con participación de OSE,2013-12-15 11:32:24.352442,exitoso,sociedades_annimas_con_participa_2,Administración de las Obras Sanitarias del Estado
Denuncias por acoso laboral,2014-01-21 21:26:29.148941,exitoso,denuncias_por_acoso_laboral,Ministerio de Trabajo y Seguridad Social
Régimen de contratación de la librería ubicada en la biblioteca nacional,2014-01-21 18:26:00.79668,exitoso,rgimen_de_contratacin_de_la_libr,Ministerio de Educación y Cultura
Empresas exoneradas de impuestos bajo el régimen de protección de inversiones.,2014-02-25 11:09:05.02045,terminado_por_usuario,empresas_exoneradas_de_impuestos,Ministerio de Economia y Finanzas
Lugares públicos accesibles,2014-03-05 19:30:10.088147,esperando_respuesta,lugares_pblicos_accesibles,Ministerio de Transporte y Obras Públicas
Potabilidad,2014-03-05 19:37:40.847421,esperando_respuesta,potabilidad,Ministerio de Vivienda Ordenamiento Territorial y Medio Ambiente
"Cultivo de Tabaco, Normas aplicables, Reglamentaciones, y Procedimientos al respecto",2014-01-27 03:15:41.805027,revision_interna,cultivo_de_tabaco_normas_aplicab,Ministerio de Ganaderia Agricultura y Pesca
Asociaciones civiles inscriptas en los últimos 5 años,2014-02-25 11:52:58.44888,revision_interna,asociaciones_civiles_inscriptas,Direcion Nacional de Registro
Presupuesto de la UAIP y salario de funcionarios,2015-10-08 23:13:29.735276,por_correo,presupuesto_de_la_uaip_y_salario,Unidad de Acceso a la Información Pública
Cantidad de solicitudes de acceso a la información pública y funcionarios,2015-10-08 23:24:08.161918,exitoso,cantidad_de_solicitudes_de_acces_4,ANTEL
Sociedades Anónimas con capital público.,2014-02-11 12:15:14.192182,revision_interna,sociedades_annimas_con_capital_p,Corporación Nacional para el Desarrollo
Listado completo de proveedores del Estado.,2014-04-08 21:13:39.208281,no_retenido,listado_completo_de_proveedores,Ministerio de Economia y Finanzas
Prueba de correo AIN,2014-04-11 14:52:18.704374,esperando_respuesta,prueba_de_correo_ain,Auditoría Interna de la Nación
Normativa vigente para la habilitación de los edificios a funcionar como Escuelas Públicas,2014-03-20 18:08:43.717547,revision_interna,normativa_vigente_para_la_habili,Administración Nacional de Educación Pública - Contacto General
Horas nocturnas de funcionario de la Junta Departamental de Montevideo,2014-04-22 01:04:27.663051,waiting_clarification,horas_nocturnas_de_funcionario_d,Junta Departamental de Montevideo
"Listado de empresas proveedoras, Adjudicatarias y contratadas por del estado",2014-04-10 01:17:16.419179,no_retenido,listado_de_empresas_proveedoras,Contaduría General de la Nación
Ubicación geográfica de estaciones de servicio,2014-04-22 03:49:48.674096,exitoso,ubicacin_geogrfica_de_estaciones,ANCAP
Datos de posición de omnibus en un período de tiempo.,2014-04-05 20:27:55.95934,revision_interna,datos_de_posicin_de_omnibus_en_u,Intendencia de Montevideo
Resultados detallados de los análisis químicos del agua corriente para consumo humano desde diciembre de 2012 a marzo de 2013 inclusive.,2013-04-04 16:00:23.763247,exitoso,resultados_detallados_de_los_anl,Administración de las Obras Sanitarias del Estado
Evaluaciones finales Convocatoria a proyectos 2013,2013-04-29 17:35:18.690712,rechazado,evaluaciones_finales_convocatori,Television Nacional del Uruguay
Informe sobre cuales son los mecanismo  de control que posee el Plan CAIF.,2013-04-23 02:27:09.793713,rechazado,informe_sobre_cuales_son_los_mec,Dirección General de Secretaría del Ministerio de Desarrollo Social
Queremos saber cuál es el criterio que utiliza ANEP para contratar espacios publicitarios en los diarios de circulación nacional,2013-04-18 14:41:43.335138,rechazado,queremos_saber_cul_es_el_criteri,Administración Nacional de Educación Pública - Contacto General
Notificar acerca del destino de los gastos que realizó el INAU en 2012,2013-04-22 23:56:40.892721,rechazado,notificar_acerca_del_destino_de,Instituto Nacional del Nino y el Adolescente del Uruguay
Publicidades de Uruguay Natural 2010- 2012,2013-04-29 22:53:31.95831,rechazado,publicidades_de_uruguay_natural,Ministerio de Turismo y Deporte
Becas o subsidios para estudiantes de Montevideo que estudien en el interior,2013-10-13 01:31:27.88987,rechazado,becas_o_subsidios_para_estudiant,Administración Nacional de Educación Pública - Contacto General
VAL GNL del Plata terminal de recepción y regasificación de gas natural licuado,2013-05-19 03:26:40.030432,rechazado,val_gnl_del_plata_terminal_de_re,Ministerio de Vivienda Ordenamiento Territorial y Medio Ambiente
Destino del dinero y bienes incautados,2013-05-13 02:22:04.838213,rechazado,destino_del_dinero_y_bienes_inca,Junta Nacional de Drogas
Problemas de Comunicacion entre Antel y los cajeros del Brou el día 09/05/2013,2013-09-12 13:59:27.816347,rechazado,problemas_de_comunicacion_entre,ANTEL
Autorización ambiental para Planta Regasificadora de Gas Licuado,2013-05-28 00:22:44.339291,rechazado,autorizacin_ambiental_para_plant,Ministerio de Vivienda Ordenamiento Territorial y Medio Ambiente
Solicito se me entregue la Ley de Salud Pública vigente en el país.,2013-06-13 05:46:52.80157,rechazado,solicito_se_me_entregue_la_ley_d,Dirección General de Secretaría del Ministerio de Salud Pública
Convenio OPP-MEC-Intendencia de Colonia,2013-07-15 16:21:29.703785,rechazado,convenio_opp_mec_intendencia_de,Oficina de Planeamiento y Presupuesto
"""Cantidad de funcionarios y pacientes en situacion de CTI del Hospital Pereira Rossell""",2013-10-01 03:22:06.072702,rechazado,cantidad_de_funcionarios_y_pacie,Dirección General de Secretaría del Ministerio de Salud Pública
Datos de donaciones a partidos políticos para campaña electoral,2013-08-25 16:35:49.68989,rechazado,datos_de_donaciones_a_partidos_p,Corte Electoral
"Habilitacion de plantas elaboradoras ,de alimentos para rumeantes",2013-09-13 22:16:28.473494,rechazado,habilitacion_de_plantas_elaborad,Ministerio de Ganaderia Agricultura y Pesca
Convenio o contrato suscrito con la empresa EQUIFAX - clearing de informes,2013-05-14 16:38:40.790398,rechazado,convenio_o_contrato_suscrito_con,Intendencia Departamental de Canelones
Información del convenio del para deportistas de alto rendimiento con la acj,2013-08-30 15:20:17.519196,rechazado,informacin_del_convenio_del_para,Secretaría Nacional de Deporte
Pedido de prueba para Corte Electoral,2013-08-25 01:26:34.294179,rechazado,pedido_de_prueba_para_corte_elec,Corte Electoral
Sobre inserción laboral de las personas con discapacidad,2013-10-03 02:41:44.655114,rechazado,sobre_insercin_laboral_de_las_pe,Ministerio de Trabajo y Seguridad Social
Saber el número de ómnibus que circulan con accesibilidad para sillas de ruedas,2013-10-03 19:57:21.365409,rechazado,saber_el_nmero_de_mnibus_que_cir,Dirección Nacional de Transporte
"Porcentaje de ausentismo docente en secundaria, en 2012 y lo que va de 2013",2013-10-08 14:39:51.713599,por_correo,porcentaje_de_ausentismo_docente,Ministerio de Educación y Cultura
Cantidad de Motos empadronadas en Canelones desde 2010 a la Fecha,2013-12-02 19:12:49.549789,por_correo,cantidad_de_motos_empadronadas_e_2,Intendencia Departamental de Canelones
Cantidad de Motos empadronadas en Montevideo desde 2010 a la Fecha,2013-12-02 19:09:16.10517,waiting_clarification,cantidad_de_motos_empadronadas_e,Intendencia de Montevideo
Dinero gastado en publicidad desde octubre 2011 a octubre 2013.,2013-10-17 02:30:00.313354,rechazado,dinero_gastado_en_publicidad_des,ANTEL
Obras Canal Andreoni - La Coronilla - Rocha,2012-10-08 13:56:44.539943,rechazado,obras_canal_andreoni_la_coronill,Dirección Nacional de Hidrografía
Solicitud de información de Asistentes Sociales y/o Lic. en Trabajo Social.,2014-07-06 02:08:14.202612,revision_interna,solicitud_de_informacin_de_asist_6,Ministerio de Trabajo y Seguridad Social
Solicitud de información de Asistentes Sociales y/o Lic. en Trabajo Social,2014-07-06 02:22:36.675981,esperando_respuesta,solicitud_de_informacin_de_asist_8,UE 030: Dirección Nacional de Sanidad Policial
La cantidad de dinero gastada en los viajes realizados por la Intendenta de Montevideo,2013-04-21 19:28:32.655446,por_correo,la_cantidad_de_dinero_gastada_en,Intendencia de Montevideo
"Listado de vehículos que posee la intendencia, con detalle de precio y bajo que área de la intendencia funcionan",2013-04-23 02:25:30.62797,por_correo,listado_de_vehculos_que_posee_la,Intendencia de Montevideo
Registro de Terreno en Maldonado - Playa Grande,2013-06-03 00:16:16.847176,rechazado,registro_de_terreno_en_maldonado_2,Ministerio de Educación y Cultura
Presupuesto destinado a Gestion de Residuos Solidos,2013-07-22 02:23:28.515196,por_correo,presupuesto_destinado_a_gestion,Intendencia de Montevideo
Residuos y destino de residuos,2013-07-22 02:50:19.429972,por_correo,residuos_y_destino_de_residuos,Intendencia de Montevideo
Reparación Calle,2013-09-23 15:21:28.887201,not_foi,reparacion_calle,Intendencia de Montevideo
Cantidad de ómnibus que circulan por Montevideo con accesibilidad para sillas de ruedas,2013-10-03 20:00:42.210268,waiting_clarification,cantidad_de_mnibus_que_circulan,Intendencia de Montevideo
Precio del supergas,2013-07-17 04:11:48.570036,exitoso,precio_del_supergas,ANCAP
"Rendición  de cuentas anual de la gestión municipal de la Intendencia de Montevideo, años 2009-2014",2015-01-13 12:51:16.395307,exitoso,rendicion_de_cuentas_anual_de_la_2,Intendencia de Montevideo
Uso vehículo oficiales MIDES,2015-02-02 14:22:02.065784,esperando_respuesta,uso_vehiculo_oficiales_mides,Dirección General de Secretaría del Ministerio de Desarrollo Social
Conexión de agua potable en asentamientos,2016-02-07 15:05:47.992821,esperando_respuesta,conexion_de_agua_potable_en_asen,Ministerio de Vivienda Ordenamiento Territorial y Medio Ambiente
Solicitud de información de Asistentes Sociales y/o Lic. en Trabajo Social.,2014-07-06 02:35:34.882182,revision_interna,solicitud_de_informacin_de_asist_10,Instituto Nacional del Nino y el Adolescente del Uruguay
Presupuesto asignado a la obra Corredor Garzón,2015-02-26 13:48:57.616438,por_correo,presupuesto_asignado_a_la_obra_c,Intendencia de Montevideo
Costos de la Embajada en Madrid,2015-03-13 22:11:49.663058,esperando_respuesta,costos_de_la_embajada_en_madrid,Ministerio de Relaciones Exteiores
Rendición de Cuentas anual de la gestión municipal 2009-2011,2015-03-18 21:30:09.768502,unsatisfactory_response,rendicion_de_cuentas_anual_de_la_3,Intendencia de Durazno
Referentes Pares,2016-02-09 22:51:21.119789,esperando_respuesta,referentes_pares,Administración Nacional de Educación Pública - Contacto General
Programa Centros de Primera Infancia,2016-02-09 22:56:24.763895,esperando_respuesta,programa_centros_de_primera_infa,Instituto Nacional del Nino y el Adolescente del Uruguay
Información sobre investigaciones en pensiones y jubilaciones fraudulentas,2015-01-08 11:41:00.49412,por_correo,informacion_sobre_investigacione,Banco de Previsión Social
Solicito información sobre la ley de viviendas donde especifique la cesion de partes sociales en una cooperativa modalidad propietario,2016-02-05 15:08:01.776357,esperando_respuesta,solicito_informacion_sobre_la_le,Ministerio de Vivienda Ordenamiento Territorial y Medio Ambiente
Stock de viviendas,2016-02-09 22:58:06.529762,esperando_respuesta,stock_de_viviendas,Ministerio de Vivienda Ordenamiento Territorial y Medio Ambiente
Implementación de la historia clínica electrónica,2016-02-09 23:00:04.259799,esperando_respuesta,implementacion_de_la_historia_cl,Dirección General de Secretaría del Ministerio de Salud Pública
Trabajo de ediles y remuneración de los mismos.,2016-03-14 17:10:40.290532,revision_interna,trabajo_de_ediles_y_remuneracion,Intendencia Departamental de Flores
Cobertura Nacional a TV Sodre y Radiodifusión Nacional de Uruguay,2016-02-07 15:10:34.441288,por_correo,cobertura_nacional_a_tv_sodre_y,Ministerio de Educación y Cultura
